{
  "schema_version": "2.0",
  "species_policy": {
    "policy": "common framework; parameters kept separately by macaque species and source; no unjustified averaging; human/cat excluded from macaque defaults",
    "approval_reference": "Sentinel_601db2e51e7c81919e962a4cc23a6f39",
    "named_reference": "explicit opt-in, mixed provenance disclosed, not main model",
    "chen2024_approval_reference": "Sentinel_db5d1bccdbbc8191bed02a864c13f5f4"
  },
  "sources": [
    {
      "source_id": "SF2025_runColFun_m",
      "title": "Somaratna & Freeman 2025 author asset: runColFun.m",
      "authors": [
        "Somaratna MA",
        "Freeman AW"
      ],
      "publication_year": 2025,
      "doi_or_canonical_url": "https://github.com/AlanFreeman/Colour/blob/5406d1533dae1678f94687379ac078a612f6170f/runColFun.m",
      "artifact_kind": "code",
      "repository_commit": "5406d1533dae1678f94687379ac078a612f6170f",
      "source_path": "data/source_snapshots/somaratna_freeman_5406d153/runColFun.m",
      "source_locator": "calConv 52-65; calDeriv 67-107; gang 266-298; solveF 413-469; solveT 471-510; weight 512-550",
      "asset_sha256": "2250208391e483f521320163eb9803e2349ed9bd83cb18ef75f36dde8547533b",
      "source_blob_sha1": "f5bff71d1e8b7c105926c9b4ac657c86608bc632",
      "license": "CC BY 4.0; License.txt",
      "verification_level": "code_verified",
      "provenance_notes": "Actual fixed-commit file downloaded and hashed. Code source, not primary measurement. MAT identity is not numerical table verification.",
      "retrieved_at": "2026-10-10T10:51:59.797844+00:00",
      "upstream_sources_checked": {
        "author_code": "Relevant functions/parameter literals statically audited",
        "upstream_papers": "not independently reread in this execution; preserve author citation labels and supplied audit limitations"
      }
    },
    {
      "source_id": "SF2025_setColLit_m",
      "title": "Somaratna & Freeman 2025 author asset: setColLit.m",
      "authors": [
        "Somaratna MA",
        "Freeman AW"
      ],
      "publication_year": 2025,
      "doi_or_canonical_url": "https://github.com/AlanFreeman/Colour/blob/5406d1533dae1678f94687379ac078a612f6170f/setColLit.m",
      "artifact_kind": "code",
      "repository_commit": "5406d1533dae1678f94687379ac078a612f6170f",
      "source_path": "data/source_snapshots/somaratna_freeman_5406d153/setColLit.m",
      "source_locator": "literature-model constants and fit coefficients, entire file",
      "asset_sha256": "a85b2f03535acaabb211feff89fcd3c3f3ed8c012417d7076b0acf447a8abeb8",
      "source_blob_sha1": "d693418ab7d72af3d5267ca9b49dc684c74967c7",
      "license": "CC BY 4.0; License.txt",
      "verification_level": "code_verified",
      "provenance_notes": "Actual fixed-commit file downloaded and hashed. Code source, not primary measurement. MAT identity is not numerical table verification.",
      "retrieved_at": "2026-10-10T10:51:59.797844+00:00",
      "upstream_sources_checked": {
        "author_code": "Relevant functions/parameter literals statically audited",
        "upstream_papers": "not independently reread in this execution; preserve author citation labels and supplied audit limitations"
      }
    },
    {
      "source_id": "SF2025_runCol_m",
      "title": "Somaratna & Freeman 2025 author asset: runCol.m",
      "authors": [
        "Somaratna MA",
        "Freeman AW"
      ],
      "publication_year": 2025,
      "doi_or_canonical_url": "https://github.com/AlanFreeman/Colour/blob/5406d1533dae1678f94687379ac078a612f6170f/runCol.m",
      "artifact_kind": "code",
      "repository_commit": "5406d1533dae1678f94687379ac078a612f6170f",
      "source_path": "data/source_snapshots/somaratna_freeman_5406d153/runCol.m",
      "source_locator": "entire source file",
      "asset_sha256": "84a311331cc07c7fa73129453916862f3c25669914004e650a5332d070a70541",
      "source_blob_sha1": "03dc9065ad6abb34175c1452d36e214dfd4786fc",
      "license": "CC BY 4.0; License.txt",
      "verification_level": "identity_verified",
      "provenance_notes": "Actual fixed-commit file downloaded and hashed. Code source, not primary measurement. MAT identity is not numerical table verification.",
      "retrieved_at": "2026-10-10T10:51:59.797844+00:00",
      "upstream_sources_checked": {
        "author_code": "Downloaded identity/bytes verified; no numerical decoding or complete code audit claimed",
        "upstream_papers": "not independently reread in this execution; preserve author citation labels and supplied audit limitations"
      }
    },
    {
      "source_id": "SF2025_runColTask_m",
      "title": "Somaratna & Freeman 2025 author asset: runColTask.m",
      "authors": [
        "Somaratna MA",
        "Freeman AW"
      ],
      "publication_year": 2025,
      "doi_or_canonical_url": "https://github.com/AlanFreeman/Colour/blob/5406d1533dae1678f94687379ac078a612f6170f/runColTask.m",
      "artifact_kind": "code",
      "repository_commit": "5406d1533dae1678f94687379ac078a612f6170f",
      "source_path": "data/source_snapshots/somaratna_freeman_5406d153/runColTask.m",
      "source_locator": "resp: output rectification line 666",
      "asset_sha256": "2bb25c70e69f4e4cfdbbefd8d5505cd8322cca192cd5c714ceb24d6f10877c39",
      "source_blob_sha1": "faa49e774406377e56a10a0a8fd692107b4ce0a3",
      "license": "CC BY 4.0; License.txt",
      "verification_level": "code_verified",
      "provenance_notes": "Actual fixed-commit file downloaded and hashed. Code source, not primary measurement. MAT identity is not numerical table verification.",
      "retrieved_at": "2026-10-10T10:51:59.797844+00:00",
      "upstream_sources_checked": {
        "author_code": "Relevant functions/parameter literals statically audited",
        "upstream_papers": "not independently reread in this execution; preserve author citation labels and supplied audit limitations"
      }
    },
    {
      "source_id": "SF2025_setColFun_m",
      "title": "Somaratna & Freeman 2025 author asset: setColFun.m",
      "authors": [
        "Somaratna MA",
        "Freeman AW"
      ],
      "publication_year": 2025,
      "doi_or_canonical_url": "https://github.com/AlanFreeman/Colour/blob/5406d1533dae1678f94687379ac078a612f6170f/setColFun.m",
      "artifact_kind": "code",
      "repository_commit": "5406d1533dae1678f94687379ac078a612f6170f",
      "source_path": "data/source_snapshots/somaratna_freeman_5406d153/setColFun.m",
      "source_locator": "entire source file",
      "asset_sha256": "625ebc27f1cc5cf2924d1e32b41d7f3a453b035a42e6f9c547a946db9e584293",
      "source_blob_sha1": "f53cdedbba1290228987f329a10ed29d17919574",
      "license": "CC BY 4.0; License.txt",
      "verification_level": "identity_verified",
      "provenance_notes": "Actual fixed-commit file downloaded and hashed. Code source, not primary measurement. MAT identity is not numerical table verification.",
      "retrieved_at": "2026-10-10T10:51:59.797844+00:00",
      "upstream_sources_checked": {
        "author_code": "Downloaded identity/bytes verified; no numerical decoding or complete code audit claimed",
        "upstream_papers": "not independently reread in this execution; preserve author citation labels and supplied audit limitations"
      }
    },
    {
      "source_id": "SF2025_setColTask_m",
      "title": "Somaratna & Freeman 2025 author asset: setColTask.m",
      "authors": [
        "Somaratna MA",
        "Freeman AW"
      ],
      "publication_year": 2025,
      "doi_or_canonical_url": "https://github.com/AlanFreeman/Colour/blob/5406d1533dae1678f94687379ac078a612f6170f/setColTask.m",
      "artifact_kind": "code",
      "repository_commit": "5406d1533dae1678f94687379ac078a612f6170f",
      "source_path": "data/source_snapshots/somaratna_freeman_5406d153/setColTask.m",
      "source_locator": "entire source file",
      "asset_sha256": "ca9bddb438e58f01663d5a34e1c15e9cf658d6bffc8e224c444729f573d019de",
      "source_blob_sha1": "a428045876955017084fd337453bb2a49e1d2a2c",
      "license": "CC BY 4.0; License.txt",
      "verification_level": "identity_verified",
      "provenance_notes": "Actual fixed-commit file downloaded and hashed. Code source, not primary measurement. MAT identity is not numerical table verification.",
      "retrieved_at": "2026-10-10T10:51:59.797844+00:00",
      "upstream_sources_checked": {
        "author_code": "Downloaded identity/bytes verified; no numerical decoding or complete code audit claimed",
        "upstream_papers": "not independently reread in this execution; preserve author citation labels and supplied audit limitations"
      }
    },
    {
      "source_id": "SF2025_setCol_m",
      "title": "Somaratna & Freeman 2025 author asset: setCol.m",
      "authors": [
        "Somaratna MA",
        "Freeman AW"
      ],
      "publication_year": 2025,
      "doi_or_canonical_url": "https://github.com/AlanFreeman/Colour/blob/5406d1533dae1678f94687379ac078a612f6170f/setCol.m",
      "artifact_kind": "code",
      "repository_commit": "5406d1533dae1678f94687379ac078a612f6170f",
      "source_path": "data/source_snapshots/somaratna_freeman_5406d153/setCol.m",
      "source_locator": "entire source file",
      "asset_sha256": "09664520e16a41022a0a635221ca04c9a94a74f5d05d7039c163c48370fbb242",
      "source_blob_sha1": "a1ee457c358c10e2ea08876babd2ee0d9ceaf89a",
      "license": "CC BY 4.0; License.txt",
      "verification_level": "identity_verified",
      "provenance_notes": "Actual fixed-commit file downloaded and hashed. Code source, not primary measurement. MAT identity is not numerical table verification.",
      "retrieved_at": "2026-10-10T10:51:59.797844+00:00",
      "upstream_sources_checked": {